{
  "acceptance_created": false,
  "architecture_status": "architecture_complete",
  "artifact_id": "reiyah.validation-report.gate-a-1.1.1",
  "check_summary": {
    "fixture_cases_checked": 179,
    "indexed_artifacts_checked": 317,
    "normative_instances_checked": 223,
    "retained_sources_checked": 8,
    "schemas_checked": 60,
    "v11_required_mutations_rejected": 1010,
    "v11_required_properties_exercised": 1010
  },
  "control_summary": {
    "covered_control_ids": [
      "GA-01",
      "GA-02",
      "GA-03",
      "GA-04",
      "GA-05",
      "GA-06",
      "GA-07",
      "GA-08",
      "GA-09",
      "GA-10",
      "GA-11",
      "GA-12",
      "GA-13",
      "GA-14",
      "GA-15",
      "GA-16"
    ],
    "external_control_summary": {
      "control_id": "GA-17",
      "decision_record_id": null,
      "diagnostics": [],
      "status": "not_evaluated"
    },
    "failed_control_ids": [],
    "passed_control_ids": [
      "GA-01",
      "GA-02",
      "GA-03",
      "GA-04",
      "GA-05",
      "GA-06",
      "GA-07",
      "GA-08",
      "GA-09",
      "GA-10",
      "GA-11",
      "GA-12",
      "GA-13",
      "GA-14",
      "GA-15",
      "GA-16"
    ],
    "required_control_ids": [
      "GA-01",
      "GA-02",
      "GA-03",
      "GA-04",
      "GA-05",
      "GA-06",
      "GA-07",
      "GA-08",
      "GA-09",
      "GA-10",
      "GA-11",
      "GA-12",
      "GA-13",
      "GA-14",
      "GA-15",
      "GA-16"
    ]
  },
  "diagnostic_sort": [
    "rule_id",
    "path",
    "object_id",
    "message"
  ],
  "diagnostics": [],
  "distribution_profile": "public_open_source",
  "exit_code": 0,
  "fixture_summary": {
    "catalog_id": "reiyah.fixture-catalog.gate-a",
    "known_bad_rejected_for_declared_rule": 164,
    "known_bad_total": 164,
    "known_good_passed": 15,
    "known_good_total": 15,
    "total": 179,
    "unexpected_outcomes": 0
  },
  "index_binding": {
    "path": "gate/GATE_A_EVIDENCE_INDEX.json",
    "sha256": "sha256:308f65ba2693c13fa71d081dad3f74f56ec80617e97497a2606c0d88a07b2ceb"
  },
  "mission_release_id": "reiyah.mission@1.1.0",
  "mode": "full",
  "offline": true,
  "protocol_release_id": "reiyah.protocol.harbor-gate-a@1.1.0",
  "read_only": true,
  "report_id": "reiyah.validation-report.gate-a",
  "result": "pass",
  "runtime_authorized": false,
  "schema_id": "https://schemas.reiyah.invalid/gate-a/1.1.1/validation-report.schema.json",
  "schema_version": "1.1.1",
  "source_ledger_version": "1.1.0",
  "toolchain": {
    "jsonschema_version": "4.26.0",
    "python_implementation": "CPython",
    "python_version": "3.14.2",
    "referencing_version": "0.37.0",
    "schema_dialect": "https://json-schema.org/draft/2020-12/schema"
  },
  "validation_plan_id": "reiyah.validation-plan.gate-a-public-1.1.1",
  "version": "1.1.1"
}
